{
  "authoringVersion": 1,
  "id": "recipe_000019",
  "contentVersion": 1,
  "status": "published",
  "inspirationTitle": "Naruto / Demon Slayer",
  "prepMinutes": 15,
  "cookMinutes": 10,
  "servings": 4,
  "difficulty": "easy",
  "contentOrigin": "adapted",
  "sourceNote": "Editorial rebuild from user-provided NotebookLM recipe research PDF exported 2026-10-22; culinary composition audited 2026-10-23.",
  "imageAssetId": "recipe_000019_artwork",
  "ingredients": [
    {
      "id": "shiratamako",
      "quantity": 100,
      "unit": "g"
    },
    {
      "id": "silken_tofu",
      "quantity": 100,
      "unit": "g"
    },
    {
      "id": "soy_sauce",
      "quantity": 2,
      "unit": "tbsp"
    },
    {
      "id": "sugar",
      "quantity": 2,
      "unit": "tbsp"
    },
    {
      "id": "mirin",
      "quantity": 1,
      "unit": "tbsp"
    },
    {
      "id": "water",
      "quantity": 100,
      "unit": "ml"
    },
    {
      "id": "cornstarch",
      "quantity": 1,
      "unit": "tbsp"
    }
  ],
  "steps": [
    {
      "id": "step_1",
      "timerSeconds": null
    },
    {
      "id": "step_2",
      "timerSeconds": null
    },
    {
      "id": "step_3",
      "timerSeconds": null
    },
    {
      "id": "step_4",
      "timerSeconds": null
    }
  ],
  "locales": {
    "en": {
      "title": "Mitarashi Dango",
      "ingredients": {
        "shiratamako": {
          "name": "Shiratamako glutinous rice flour",
          "note": null
        },
        "silken_tofu": {
          "name": "Silken tofu",
          "note": null
        },
        "soy_sauce": {
          "name": "Soy sauce",
          "note": null
        },
        "sugar": {
          "name": "Sugar",
          "note": null
        },
        "mirin": {
          "name": "Mirin",
          "note": null
        },
        "water": {
          "name": "Lukewarm water",
          "note": null
        },
        "cornstarch": {
          "name": "Cornstarch",
          "note": null
        }
      },
      "steps": {
        "step_1": "Knead the glutinous rice flour with silken tofu until soft and pliable.",
        "step_2": "Form walnut-size balls, boil them and cook 2 minutes more after they float. Chill in iced water.",
        "step_3": "Thread 3–4 dumplings onto each skewer and grill briefly to create light char marks.",
        "step_4": "Heat soy sauce, sugar, mirin, water and cornstarch while whisking until glossy and thick. Coat the skewers generously."
      }
    },
    "it": {
      "title": "Mitarashi Dango",
      "ingredients": {
        "shiratamako": {
          "name": "Farina di riso glutinoso shiratamako",
          "note": null
        },
        "silken_tofu": {
          "name": "Tofu setoso",
          "note": null
        },
        "soy_sauce": {
          "name": "Salsa di soia",
          "note": null
        },
        "sugar": {
          "name": "Zucchero",
          "note": null
        },
        "mirin": {
          "name": "Mirin",
          "note": null
        },
        "water": {
          "name": "Acqua tiepida",
          "note": null
        },
        "cornstarch": {
          "name": "Amido di mais",
          "note": null
        }
      },
      "steps": {
        "step_1": "Impasta la farina di riso glutinoso con il tofu setoso fino a ottenere un panetto morbido e modellabile.",
        "step_2": "Forma palline grandi come una noce, lessale e cuocile altri 2 minuti da quando salgono a galla. Raffreddale in acqua e ghiaccio.",
        "step_3": "Infilza 3–4 dango per spiedino e grigliali brevemente per creare leggere bruciacchiature.",
        "step_4": "Scalda salsa di soia, zucchero, mirin, acqua e amido mescolando finché la salsa è lucida e densa. Nappa bene gli spiedini."
      }
    },
    "es": {
      "title": "Mitarashi Dango",
      "ingredients": {
        "shiratamako": {
          "name": "Harina de arroz glutinoso shiratamako",
          "note": null
        },
        "silken_tofu": {
          "name": "Tofu sedoso",
          "note": null
        },
        "soy_sauce": {
          "name": "Salsa de soja",
          "note": null
        },
        "sugar": {
          "name": "Azúcar",
          "note": null
        },
        "mirin": {
          "name": "Mirin",
          "note": null
        },
        "water": {
          "name": "Agua templada",
          "note": null
        },
        "cornstarch": {
          "name": "Maicena",
          "note": null
        }
      },
      "steps": {
        "step_1": "Amasa la harina de arroz glutinoso con tofu sedoso hasta obtener una masa suave.",
        "step_2": "Forma bolitas, hiérvelas y cuece 2 minutos más tras flotar. Enfría en agua con hielo.",
        "step_3": "Ensarta 3–4 dango por brocheta y ásalos brevemente.",
        "step_4": "Calienta soja, azúcar, mirin, agua y maicena hasta espesar y glasea las brochetas."
      }
    },
    "fr": {
      "title": "Mitarashi Dango",
      "ingredients": {
        "shiratamako": {
          "name": "Farine de riz gluant shiratamako",
          "note": null
        },
        "silken_tofu": {
          "name": "Tofu soyeux",
          "note": null
        },
        "soy_sauce": {
          "name": "Sauce soja",
          "note": null
        },
        "sugar": {
          "name": "Sucre",
          "note": null
        },
        "mirin": {
          "name": "Mirin",
          "note": null
        },
        "water": {
          "name": "Eau tiède",
          "note": null
        },
        "cornstarch": {
          "name": "Fécule de maïs",
          "note": null
        }
      },
      "steps": {
        "step_1": "Pétrissez la farine de riz gluant avec le tofu soyeux jusqu’à obtenir une pâte souple.",
        "step_2": "Formez des boules, faites-les bouillir 2 minutes après remontée puis refroidissez dans l’eau glacée.",
        "step_3": "Enfilez 3–4 dango par brochette et grillez brièvement.",
        "step_4": "Chauffez soja, sucre, mirin, eau et fécule jusqu’à épaississement puis nappez les brochettes."
      }
    },
    "de": {
      "title": "Mitarashi Dango",
      "ingredients": {
        "shiratamako": {
          "name": "Shiratamako-Klebreismehl",
          "note": null
        },
        "silken_tofu": {
          "name": "Seidentofu",
          "note": null
        },
        "soy_sauce": {
          "name": "Sojasauce",
          "note": null
        },
        "sugar": {
          "name": "Zucker",
          "note": null
        },
        "mirin": {
          "name": "Mirin",
          "note": null
        },
        "water": {
          "name": "Lauwarmes Wasser",
          "note": null
        },
        "cornstarch": {
          "name": "Maisstärke",
          "note": null
        }
      },
      "steps": {
        "step_1": "Klebreismehl mit Seidentofu zu einem weichen Teig kneten.",
        "step_2": "Kugeln formen, kochen und nach dem Aufsteigen noch 2 Minuten garen. In Eiswasser abschrecken.",
        "step_3": "Je 3–4 Dango aufspießen und kurz angrillen.",
        "step_4": "Sojasauce, Zucker, Mirin, Wasser und Stärke dicklich kochen und die Spieße glasieren."
      }
    },
    "pt": {
      "title": "Mitarashi Dango",
      "ingredients": {
        "shiratamako": {
          "name": "Farinha de arroz glutinoso shiratamako",
          "note": null
        },
        "silken_tofu": {
          "name": "Tofu sedoso",
          "note": null
        },
        "soy_sauce": {
          "name": "Molho de soja",
          "note": null
        },
        "sugar": {
          "name": "Açúcar",
          "note": null
        },
        "mirin": {
          "name": "Mirin",
          "note": null
        },
        "water": {
          "name": "Água morna",
          "note": null
        },
        "cornstarch": {
          "name": "Amido de milho",
          "note": null
        }
      },
      "steps": {
        "step_1": "Amasse a farinha de arroz glutinoso com tofu sedoso até obter uma massa macia.",
        "step_2": "Faça bolinhas, ferva e cozinhe mais 2 minutos após subirem. Resfrie em água com gelo.",
        "step_3": "Espete 3–4 dangos por palito e grelhe rapidamente.",
        "step_4": "Aqueça soja, açúcar, mirin, água e amido até engrossar e cubra os espetos."
      }
    }
  }
}
